date,title,body,url,image,source
2022-09-23T05:12:00,"Guerra Ucrania Rusia, en directo | Miles de rusos huyen para no ser movilizados en el frente","La Unión Europea busca un acuerdo para la acogida de los reservistas rusos que huyan del país, como ha hecho Alemania, aunque con recelo de los miembros bálticos.",https://www.lasexta.com/noticias/internacional/guerra-ucrania-rusia-directo-miles-rusos-huyen-ser-movilizados-frente_20220923632d37bcc270fa0001e9978b.html,"https://fotografias.lasexta.com/clipping/cmsimages01/2022/09/23/98BABAF1-D258-44CD-8C9C-BD12D1AB7C35/guerra-ucrania-rusia-directo-miles-rusos-huyen-ser-movilizados-frente_69.jpg?crop=1120,630,x0,y2&width=1280&height=720&optimize=low&format=jpg",laSexta
2022-09-09T12:46:00,Los mapas de la 28ª semana de guerra en Ucrania,"Los ataques en la zona de Energodar y los sucesivos reproches entre Ucrania y Rusia, que se acusan mutuamente, habían obligado a aplazar la visita temporalmente. En Moscú, distintas fuentes ...",https://www.rtve.es/noticias/20220909/mapas-guerra-ucrania-semana-28/2399940.shtml,,RTVE
2022-09-09T08:17:00,Guerra Ucrania Rusia: Últimas noticias del 10 de septiembre en directo,"La presidenta de la Comisión Europea, Ursula Von der Leyen, y el secretario de Estado norteamericano, Antony Blinken, han hablado por teléfono este sábado sobre la situación actual en Ucrania ...",https://www.antena3.com/noticias/mundo/ultima-hora-guerra-rusia-ucrania-sigue-movimiento-tropas-rusas-reacciones-putin-zelenski_20220909631adb2aa1854f00017a81b5.html,,Antena 3
2022-09-03T09:48:00,Guerra Ucrania Rusia: Últimas noticias del 4 de septiembre en directo,Buenas noches y gracias por seguir la última hora de la invasión rusa en Ucrania! Rusia se ha defendido de las críticas en la Unión Europea (UE) por el corte de gas ruso mediante el gasoducto ...,https://www.antena3.com/noticias/mundo/guerra-ucrania-rusia-hoy-ultima-hora-directo-putin-zelenski-ultimas-noticias-invasion-rusa_202209036312f4ee1d9fe00001c4cc3d.html,,Antena 3
2022-09-02T23:06:00,"Resumen de la guerra entre Ucrania y Rusia el 2 de septiembre: Bruselas acusa a Moscú de ""pretextos falaces"" por cortar el Nord Stream 1","La guerra en Ucrania cumple este viernes 191 días desde el inicio de la invasión rusa. Las tropas ucranianas han iniciado esta semana una contraofensiva en el frente sur, donde intentan ...",https://www.rtve.es/noticias/20220902/guerra-ucrania-directo-ultima-hora-noticias/2399696.shtml,,RTVE
2022-08-26T08:05:00,Guerra Ucrania Rusia: Últimas noticias del 27 de agosto en directo,"Moldavia recibió en junio pasado junto a Ucrania el estatus de país candidato al ingreso en la UE, lo que Sandu calificó entonces de luz al final del túnel. Ucrania pide a la comunidad ...",https://www.antena3.com/noticias/mundo/ultima-hora-guerra-rusia-ucrania-movimiento-tropas-reacciones-putin-zelenski_20220826630863588d51040001e4ef35.html,,Antena 3
2022-08-25T23:55:00,DIRECTO: guerra en Ucrania,"La guerra en Ucrania cumple este jueves 183 días con la ofensiva estancada y sin claros vencedores. Rusia continúa atacando en la región de Donetsk, pero no ha logrado conquistar ...",https://www.rtve.es/noticias/20220825/guerra-ucrania-directo-ultima-hora-noticias/2398281.shtml,,RTVE
2022-08-24T10:22:00,Guerra Ucrania - Rusia hoy | Directo: Zelenski aboga por la desocupación de Crimea como hito para el conjunto de Europa,Sigue aquí las últimas noticias sobre la guerra que enfrenta a Ucrania con Rusia desde que el pasado 24 de febrero el presidente Vladimir Putin dio la orden de invasión. Este directo ha estado ...,https://www.europapress.es/internacional/noticia-guerra-ucrania-rusia-hoy-directo-ultimas-noticias-20220817132028.html,,Europa Press
2022-08-24T10:21:00,Los datos de seis meses de guerra en Ucrania,"La guerra de Ucrania cumple seis meses y lejos queda el ataque relámpago con el que que se especulaba el 24 de febrero, cuando las tropas rusas invadieron el país por varios frentes. Tras muchos ...",https://www.rtve.es/noticias/20220824/seis-meses-guerra-ucrania-datos/2397140.shtml,,RTVE
