date,title,body,url,image,source
2021-06-12T23:47:00,Kamala Harris aparece en el desfile del Orgullo gay en Washington,"Kamala Harris, vicepresidenta de Estados Unidos, hizo una breve aparición este sábado en el desfile del Orgullo gay en Washington. Harris dijo que aún queda mucho por hacer en cuanto a la ...",https://cnnespanol.cnn.com/video/kamala-harris-orgullo-gay-desfile-washington-vo-rafael-romo-mirador/,,CNN
2021-01-07T14:14:00,Qué hacer cuando un hijo se declara gay,"Sin embargo, los padres o abuelos no deben sentir que han perdido a su hijo o nieto por ser homosexual (o LGBT, lesbiana, gay, bisexual o transgénero), explica Ken Howard, psicoterapeuta, experto en apoyo a la población LGBT y autor del libro ...",https://www.aarp.org/espanol/hogar-familia/familia-bienestar/info-06-2013/hijo-gay-hija-homosexual-consejos.html,,AARP
2019-12-08T00:01:00,Residencia Universitaria Jesús Bal y Gay,"La R.U. Jesús Bal y Gay, situada en la Carretera da Granxa, 130, es la única residencia propia de la USC en el Campus Universitario de Lugo. Fue terminada en el año 1994 por el Ayuntamiento de Lugo y cedida a la USC en el curso 1994/95.",https://www.usc.es/es/servizos/sur/residencias/balygay/,,usc.es
2019-04-09T16:40:00,Chat Gay en Cádiz (Cádiz) - Empresite,Encontrados 2 resultados de empresas que pueden tener alguna relación con la búsqueda realizada Chat Gay en Cádiz. Hay 14 localidades donde se encuentran resultados relacionados con Chat Gay. Estos resultados pueden estar relacionados con ...,https://empresite.eleconomista.es/Actividad/CHAT-GAY/localidad/CADIZ/,,elEconomista
2017-12-17T18:02:00,"'My Brother's Husband', el manga gay que se convertirá en una serie de televisión","Este MANGA GAY será una serie de televisión en JAPÓN. Que Japón es un país de contrastes ya lo sabemos. La homosexualidad entra dentro de esos contrastes, ya que siendo uno de los países que ...",https://www.cromosomax.com/37892-my-brothers-husband-el-manga-gay-que-se-convertira-en-una-serie-de-television,,Soldados
2016-02-25T19:58:00,Soñar que eres gay: descubre tu verdadera personalidad,"Hay sueños que pueden dejarte cierta inquietud al despertar, como los que hablan de tu sexualidad. Soñar que eres gay no siempre es un sueño erótico, pero casi siempre resulta perturbador si eres heterosexual. Descubre en nuestro diccionario de sueños ...",https://www.diariofemenino.com/articulos/psicologia/significado-de-los-suenos/sonar-que-eres-gay-descubre-tu-verdadera-personalidad/,,Diario femenino
2015-09-28T08:33:00,La emotiva boda gay de un veterano de la 2ª Guerra Mundial de 95 años,EMOCIONANTE: La boda gay de un veterano de guerra de 95 años 3 El matrimonio gay en USA ya es toda una realidad y nos trae historias tan bonitas como la de John Banvard y Gerard Nadeau.,https://www.cromosomax.com/31097-la-emotiva-boda-gay-de-un-veterano-de-la-2a-guerra-mundial-de-95-anos,,Soldados
2015-06-25T17:26:00,Un estudio afirma que el tamaño de tus dedos determina si eres gay o no,MANOS ARRIBA! Un estudio concluye que se puede SABER SI ERES GAY mirando tus dedos. ¿Acierta o no? Cuántas veces hemos escuchado que el tamaño de la mano tiene relación directa con el tamaño ...,https://www.cromosomax.com/30203-un-estudio-afirma-que-el-tamano-de-tus-dedos-determina-si-eres-gay-o-no,,Soldados
2014-08-25T14:23:00,"El cantante gay country Josey Greenwell ""se convierte"" en el hetero Nate Green y amenaza a quienes le cuestionan",El cantante gay country Josey Greenwell se convierte en el hetero Nate Green y amenaza a quienes le cuestionan. ABSURDO: un cantante gay vuelve al armario cambiando de nombre y amenaza a quienes ...,https://www.cromosomax.com/27279-el-cantante-gay-country-josey-greenwell-se-convierte-en-el-hetero-nate-green-y-amenaza-a-quienes-le-cuestionan,,Soldados
2014-07-30T14:30:00,Un luchador de la UFC apoya al colectivo gay con un mensaje en sus calzoncillos,Un luchador de la UFC apoya al colectivo gay con un mensaje en sus calzoncillos. Es uno de los momentos más homoeróticos del deporte: cuando los boxeadores se desnudan para pesarse. Pues bien ...,https://www.cromosomax.com/27002-un-luchador-de-la-ufc-apoya-al-colectivo-gay-con-un-mensaje-en-sus-calzoncillos,,Soldados
2014-07-15T14:30:00,La ley anti gay interrumpe el tratamiento con el VIH de los infectados en todo el país,La ley anti gay interrumpe el tratamiento con el VIH de los infectados en todo el país. La homofobia que se vive en el gobierno de Nigeria está convirtiéndose en un genocidio pasivo ...,https://www.cromosomax.com/26838-la-ley-anti-gay-interrumpe-el-tratamiento-con-el-vih-de-los-infectados-en-todo-el-pais,,Soldados
2014-06-30T09:18:00,"Orgullo Gay Noticias, reportajes, vídeos y fotografías","también conocido como Orgullo Gay (Gay Pride en inglés) es una fiesta anual que se celebra el 28 de junio (conmemoración de los disturbios de Stonewall, Nueva York, de 1969, inicio del ...",https://www.libertaddigital.com/temas/orgullo-gay/,,Libertad Digital
2014-06-03T11:14:00,El diario perdido del «Enola Gay»,"NO FUERON «¡Dios mío, qué hemos hecho!» las primeras palabras que exclamó el copiloto Lewis, autor del diario, sino otras políticamente incorrectas: «¡Guau, menudo pepinazo!».",https://www.elmundo.es/cronica/2004/460/1092067836.html,,El Mundo
2014-02-24T12:38:00,¿Dónde es ilegal ser gay en el mundo?,"Entonces, ¿dónde es ilegal ser gay?, ¿cuáles países permiten el matrimonio homosexual? Explore el mapa de las naciones que integran la ONU. Los países están clasificados por colores ...",https://www.bbc.com/mundo/noticias/2014/02/140224_mapa_homosexualidad_mundo_amv,,BBC
2013-06-13T14:54:00,Un chico gay de 11 años consigue que retiren un premio a un político homófobo,Pequeños gestos que hacen historia: un niño de 11 años abiertamente gay ha conseguido que retiren un premio honorífico a un político homófobo. Pongámonos en situación: el republicano John ...,https://www.cromosomax.com/22805-un-chico-gay-de-11-anos-consigue-que-retiren-un-premio-a-un-politico-homofobo,,Soldados
2013-04-15T12:10:00,"La historia de Richard Socarides, hijo gay de uno de los creadores de la terapia de reorientación sexual","Richard Socarides es el hijo gay de Charles W. Socarides. Por el nombre lo te sonarán, pero paradójicamente resulta que Charles era un psiquiatra en Nueva York que sostenía que la ...",https://www.cromosomax.com/22146-la-historia-de-richard-socarides-hijo-gay-de-uno-de-los-creadores-de-la-terapia-de-reorientacion-sexual,,Soldados
