date,title,body,url,image,source
2017-02-02T02:18:00,Cortes de Inmigración de EEUU se concentrarán en detenidos,"1 de febrero de 2017, 9:05 p. m. WASHINGTON (AP) — Las cortes de inmigración de Estados Unidos cambiarán de proceder para concentrarse más en audiencias de deportación de inmigrantes encarcelados por el gobierno federal. La nueva política dará ...",https://es-us.noticias.yahoo.com/cortes-inmigraci-n-eeuu-se-concentrar-n-en-005221803.html,,Yahoo Noticias en Español
2016-09-20T21:15:00,"Trump, a la ofensiva contra inmigración tras atentados en EEUU","20 de septiembre de 2016, 1:54 p. m. Donald Trump volvió a encender el debate sobre la inmigración tras los atentados que este fin de semana dejaron decenas de heridos en Estados Unidos, al reanudar sus ataques contra los refugiados sirios y atribuir el ...",https://es.noticias.yahoo.com/trump-la-ofensiva-contra-inmigraci%C3%B3n-tras-atentados-en-204600389.html,,Yahoo Noticias España
2016-08-21T07:16:00,Candidatos chocan por inmigración,"La inmigración volvió a situarse en la última semana en el centro de la campaña electoral de Estados Unidos, después de que el candidato presidencial por el Partido Republicano, Donald Trump ...",https://www.elpais.com.uy/mundo/candidatos-chocan-inmigracion.html,,El Pais
2016-08-05T04:47:00,La inmigración española y europea en la Argentina,"Recordemos que para muchos españoles, sobre todo para los individuos pertenecientes a sectores socioeconómicamente no privilegiados, la conquista y colonización del territorio americano ...",https://es.paperblog.com/la-inmigracion-espanola-y-europea-en-la-argentina-3943906/,,Paperblog
2013-10-25T08:06:00,"Inmigración ilegal Noticias, reportajes, vídeos y fotografías",Se considera inmigración irregular o inmigración ilegal a la migración de personas a través de las fronteras sin atender los requerimientos legales del país de destino. La persona que se ...,https://www.libertaddigital.com/temas/inmigracion-ilegal/,,Libertad Digital
