date,title,body,url,image,source
2022-08-29T19:05:00,Estrategia Andaluza para la Inmigración 2021-2025,"La Estrategia tiene como finalidad ser el instrumento general de planificación de la Comunidad Autónoma de Andalucía para las políticas que promueven la integración social de las personas migrantes, y solicitantes y beneficiarias de protección ...",https://www.juntadeandalucia.es/organismos/inclusionsocialjuventudfamiliaseigualdad/areas/politicas-migratorias/planes-inmigracion.html,,juntadeandalucia.es
2022-08-29T19:05:00,"Inmigración, interculturalidad y gestión de la diversidad","La Dirección General de Coordinación de Políticas Migratorias se suma a la celebración cada 21 de mayo, desde el año 2002, del Día Mundial de la Diversidad Cultural para el Diálogo y el Desarrollo, a través de un Manifiesto, para la puesta en valor ...",https://www.juntadeandalucia.es/organismos/inclusionsocialjuventudfamiliaseigualdad/areas/politicas-migratorias/convocatorias.html,,juntadeandalucia.es
2022-08-29T13:32:00,La inmigración india sustituye a la europea en el Reino Unido,La nueva política de inmigración del Reino Unido ha producido un gran aumento de visados concedidos a trabajadores asiáticos y una reducción radical de los procedentes de países de la Unión ...,https://www.diariovasco.com/internacional/europa/inmigracion-india-sustituye-20220829152858-ntrc.html,,Diario
2022-08-29T00:00:00,La inmigración irregular a Europa se dispara: crece un 86% respecto a 2021 y al mayor ritmo desde 2016,"Un total de 155.090 personas han entrado de forma irregular en Europa entre el 1 de enero y el 31 de julio de 2022, según ha informado la Agencia Europea de la Guardia de Fronteras y Costas ...",https://www.elespanol.com/mundo/europa/20220829/inmigracion-irregular-europa-crece-respecto-mayor/699180194_0.html,,ESPAÑOL
2022-08-29T00:00:00,"La Junta apuesta por un acuerdo de Estado en inmigración, respuesta ""coordinada"" de la UE y huir de la confrontación","La consejera de Justicia e Interior, Rosa Aguilar, ha apostado por alcanzar un gran acuerdo de Estado que incluya a las comunidades, los ayuntamientos y las entidades sociales, para dar respuesta ...",https://www.europapress.es/andalucia/noticia-junta-apuesta-alcanzar-acuerdo-estado-inmigracion-respuesta-coordinada-ue-huir-confrontacion-20180829202350.html,,Europa Press
2022-08-26T18:58:00,Hacía Uber y lo detuvo Inmigración: hispano cuenta el calvario que vivió,"Un inmigrante señaló a su abogado como el único responsable de un calvario que vivió al casi ser deportado SAN DIEGO- En ocasiones uno de los peores enemigos de quienes buscan legalizarse en el país,",https://www.telemundonuevainglaterra.com/noticias/inmigracion/me-agarro-migracion-haciendo-uber-migrante-cuenta-calvario-tras-estar-a-punto-de-ser-deportado/2228578/,https://media.telemundoboston.com/2019/09/border-patrol-generic-twitter.JPG?fit=686%2C533&quality=85&strip=all,WNEU
2022-08-26T00:00:00,"Vox acusa a la Junta de ""alimentar inmigración ilegal e inseguridad"" e incumplir los acuerdos de investidura","El portavoz adjunto del Grupo Vox en el Parlamento de Andalucía, Rodrigo Alonso, ha manifestado este jueves que el Gobierno de Andalucía está alimentando la inmigración ilegal y la ...",https://www.europapress.es/andalucia/noticia-vox-acusa-junta-alimentar-inmigracion-ilegal-inseguridad-insta-moreno-reunirse-marlaska-20210826104448.html,,Europa Press
2022-08-26T00:00:00,PP-A pide una posición conjunta en inmigración para el primer Pleno de septiembre,"La vicesecretaria de Coordinación Institucional del PP-A, Patricia del Pozo, ha pedido este domingo a la presidenta de la Junta, Susana Díaz, que recoja la oferta de diálogo sobre la ...",https://www.europapress.es/andalucia/noticia-pp-pide-posicion-conjunta-inmigracion-primer-pleno-septiembre-20180826135115.html,,Europa Press
2022-08-25T19:17:00,"Sigue atrasado el proceso de 1,3 millones de solicitudes de inmigración a Canadá",El ministro de Inmigración de Canadá dijo este 24 de agosto que sólo tomará unos meses más de lo anticipado el regresar a los tiempos normales de espera en la tramitación de las solicitudes ...,https://ici.radio-canada.ca/rci/es/noticia/1907924/sigue-atrasado-proceso-1-3-millones-solicitudes-inmigracion-canada,,Radio-Canada
2022-08-25T16:38:00,Inmigrantes que llegan a Nueva York son monitoreados con brazaletes desde que salen de Texas,"NUEVA YORK - A medida que más autobuses de Texas llegan con cientos de solicitantes de asilo a Nueva York, los inmigrantes son registrados con el uso de brazaletes para asegurarse que lleguen a su destino final, según reportes de la Oficina de Asuntos ...",https://www.telemundo47.com/noticias/inmigracion/crisis-migratoria-en-nueva-york/inmigrantes-que-llegan-a-nueva-york-son-monitoreados-con-brazaletes-desde-que-salen-de-texas/2317078/,,Telemundo 47
2022-08-24T16:25:00,Caridades Católicas y el Tribunal de Inmigración de NY continúan servicio de ayuda pro bono,"Caridades Católicas y los Tribunales de Inmigración de la Ciudad de Nueva York lanzaron hace seis años el Servicio de Ayuda del Tribunal de Inmigración, un programa clave diseñado para ...",https://eldiariony.com/2022/08/24/caridades-catolicas-y-el-tribunal-de-inmigracion-de-ny-continuan-servicio-de-ayuda-pro-bono/,,El Diario NY
2022-08-24T14:36:00,Lanzan campaña de apoyo a proyecto que facilitaría obtener residencia en EEUU,"Una coalición de grupos proinmigrantes lanzó hoy una campaña en favor de un proyecto que beneficiaría a unos ocho millones de inmigrantes, según los activistas, al actualizar el criterio de ...",https://www.efe.com/efe/usa/inmigracion/lanzan-campana-de-apoyo-a-proyecto-que-facilitaria-obtener-residencia-en-eeuu/50000098-4871510,,EFE
2022-08-23T21:31:00,Inmigración en Europa: Reino Unido denuncia flujo récord de ilegales por el canal de la Mancha,"En medio de la creciente ola de inmigración en Europa, autoridades de los diferentes países han denunciado el incremento de dichos flujos de ilegales durante los últimos meses, en su mayoría ...",https://www.msn.com/es-co/noticias/mundo/inmigraci%C3%B3n-en-europa-reino-unido-denuncia-flujo-r%C3%A9cord-de-ilegales-por-el-canal-de-la-mancha/ar-AA110ZJt,,MSN
2022-08-23T20:08:00,"Inmigración y doble identidad son ""arma secreta de EEUU"", dice alcalde Nueva York","El alcalde de Nueva York, Eric Adams, comparó hoy la doble identidad que trae la emigración como un arma secreta de Estados Unidos, al presidir la ceremonia de naturalización de cuarenta ...",https://www.efe.com/efe/usa/inmigracion/inmigracion-y-doble-identidad-son-arma-secreta-de-eeuu-dice-alcalde-nueva-york/50000098-4871330,,EFE
2022-08-23T19:27:00,"Inmigración y doble identidad son ""arma secreta de EEUU"", dice alcalde New York","El alcalde de Nueva York, Eric Adams, comparó este martes la doble identidad que trae la emigración como un arma secreta de Estados Unidos, al presidir la ceremonia de naturalización de ...",https://listindiario.com/las-mundiales/2022/08/23/735602/inmigracion-y-doble-identidad-son-arma-secreta-de-eeuu-dice-alcalde-new-york,,Listín Diario
2022-08-23T18:09:00,"Inmigración y doble identidad son ""arma secreta de EE.UU."", asegura alcalde Nueva York","El alcalde de Nueva York, Eric Adams, dijo que la doble identidad que trae la emigración como un arma secreta de Estados Unidos, el comparativo lo hizo durante la ceremonia de ...",https://laopinion.com/2022/08/23/inmigracion-y-doble-identidad-son-arma-secreta-de-ee-uu-asegura-alcalde-nueva-york/,,La Opinión
2022-08-23T17:52:00,"Inmigración y doble identidad son ""arma secreta de EEUU"", dice alcalde N.York","El alcalde de Nueva York, Eric Adams, comparó este martes la doble identidad que trae la emigración como un arma secreta de Estados Unidos, al presidir la ceremonia de naturalización de ...",https://www.vanguardia.com/mundo/inmigracion-y-doble-identidad-son-arma-secreta-de-eeuu-dice-alcalde-n-york-XA5604365,,Vanguardia
2022-08-23T16:01:00,"La inmigración y la doble identidad son el ""arma secreta de EE.UU."", dice el alcalde de Nueva York","Nueva York, 23 ago (EFE).- El alcalde de Nueva York, Eric Adams, comparó este martes la doble identidad que trae la emigración como un arma secreta de Estados Unidos, al presidir la ceremonia de naturalización de cuarenta personas en el edificio de la ...",https://es-us.noticias.yahoo.com/inmigraci%C3%B3n-doble-identidad-arma-secreta-155424780.html,,Yahoo Noticias en Español
2022-08-23T00:08:00,Demócratas avisan a gobernador de Florida que inmigración es asunto federal,"El presidente del Partido Demócrata de Florida, Manny Díaz, advirtió al gobernador de este estado, Ron DeSantis, que la inmigración es un asunto que le compete exclusivamente a las autoridades ...",https://www.efe.com/efe/usa/inmigracion/democratas-avisan-a-gobernador-de-florida-que-inmigracion-es-asunto-federal/50000098-4870971,,EFE
2022-08-19T15:45:00,Inmigración: la mayoría en EEUU cree que hay una invasión en la frontera sur,Una reciente encuesta de NPR/Ipsos revela que más de la mitad de los estadounidenses cree que el país sufre una invasión de migrantes desde la frontera sur. Y no solo eso. El 50 por ciento ...,https://www.msn.com/es-us/noticias/otras/inmigraci%C3%B3n-la-mayor%C3%ADa-en-eeuu-cree-que-hay-una-invasi%C3%B3n-en-la-frontera-sur/ar-AA10Qos1,,MSN
2022-08-15T00:00:00,"Inmigración Infantil: Últimas noticias, videos y fotos de Inmigración Infantil | Univision",Miles de niños que migraron junto a sus familias a Estados Unidos buscando mejores oportunidades están por comenzar su primer año escolar en el país. Para aquellos que llegan sin dominar el ...,https://www.univision.com/temas/inmigracion-infantil,,Univision
2022-08-09T14:08:00,Inmigración: 750 detenidos en ayuno de protesta,"8 de marzo de 2014, 12:29 p. m. TACOMA, Washington, EE.UU. (AP) — Activistas a favor de los derechos de los inmigrantes se reunieron frente al Centro de Detención del Noroeste el sábado mientras por lo menos 750 detenidos protestaban por el trato que ...",https://es-us.noticias.yahoo.com/inmigraci-n-750-detenidos-en-ayuno-protesta-173524204.html,,Yahoo Noticias en Español
2022-08-02T03:29:00,"Recursos de ayuda legal gratis en Chicago para casos de inmigración, violencia doméstica y desalojos",RELACIONADOS: Ayuda inmigración Chicago • Inmigración • Preguntas y respuestas Inmigracion • Asociación Americana de Abogados de Inmigración • Violencia Doméstica • TELEVISIÓN DE ...,https://www.univision.com/local/chicago-wgbo/ayuda-legal-gratis-inmigracion-chicago,,Univision
2022-06-21T23:10:00,La inmigración no fue suficiente para aumentar la población gallega en 2021,"Los inmigrantes siguen estando hoy en día mal considerados por una parte (más amplia, lamentablemente, de lo que sería deseable) de la población. Se considera, en muchas ocasiones ...",https://www.elcorreogallego.es/galicia/la-inmigracion-no-fue-suficiente-para-aumentar-la-poblacion-gallega-en-2021-ND11479037,,Elcorreogallego.es
2022-04-16T22:48:00,Conoce los beneficios que un inmigrante puede pedir sin que lo afecte la regla de carga pública,"Confusión y zozobra ha generado en los inmigrantes la regla final de carga pública anunciada esta semana por el gobierno de Trump, que impone un protocolo más estricto a la hora de evaluar ...",https://www.univision.com/noticias/inmigracion/conoce-los-beneficios-que-un-inmigrante-puede-pedir-sin-que-lo-afecte-la-regla-de-carga-publica,,Univision
2022-03-07T07:04:00,"Inmigración, educación y productividad",Uruguay tiene dos desafíos mayores de largo plazo para sustentar un mayor bienestar social: mejorar la productividad de sus trabajadores y asegurar un crecimiento demográfico capaz de financiar ...,https://www.elpais.com.uy/opinion/editorial/inmigracion-educacion-productividad.html,,El Pais
2021-10-11T11:35:00,ACTUALIZADO 16 de julio de 2019 7:42 PM,"Uno de los momentos más importantes en el proceso legal de los inmigrantes en Estados Unidos es la entrevista final con los adjudicadores del Servicio de Ciudadanía e Inmigración (USCIS), uno ...",https://www.elnuevoherald.com/noticias/finanzas/acceso-miami/asuntos-legales/article232208372.html,,El Nuevo Herald
2021-08-23T04:36:00,Inmigración en España hoy | Noticias de inmigrantes,"El ministro de Inclusión, Seguridad Social y Migraciones, José Luis Escrivá, ha negado este martes, a preguntas del senador del PP y alcalde de Algeciras (Cádiz), José Ignacio Landaluce, que ...",https://www.europapress.es/temas/inmigracion/,,Europa Press
2021-07-19T09:35:00,Inmigración y leyes internacionales,"Inmigración y leyes internacionales, podrás encontrar información práctica hecha por expertos sobre inmigración y leyes internacionales en formato texto, vídeo e imágenes. Además en cada ...",https://www.mundodeportivo.com/uncomo/negocios/inmigracion-y-leyes-internacionales/,,Mundo Deportivo
2021-07-12T00:48:00,Noticias de Inmigración ilegal,El Ministro del Interior reitera que las Fuerzas y Cuerpos de Seguridad actuaron en todo momento en el marco de la legalidad ante un intento intolerable y violento de entrada irregular,https://www.larazon.es/tags/inmigracion-ilegal/,,La Razón Digital
2021-06-10T21:42:00,Exabogados de inmigración buscan atajar la alharaca política,"WASHINGTON — Kathy Manning, ex abogada de inmigración desde hace casi dos décadas, había decidido recientemente postularse a las elecciones cuando encendió la televisión y escuchó a los políticos enzarzarse en una retórica sobre la inmigración ...",https://es-us.finanzas.yahoo.com/noticias/exabogados-inmigraci%C3%B3n-buscan-atajar-alharaca-213400965.html,,Yahoo Finanzas
2021-04-26T07:11:00,Inmigración y delincuencia: percepción y realidad.,"Es difícil hablar de cualquier cosa que no sea COVID estos días. Entendiblemente. Sin embargo, hay que seguir pensando en otros temas de largo plazo. Por eso en esta columna nos enfocamos en un ...",https://www.elpais.com.uy/economia-y-mercado/inmigracion-delincuencia-percepcion-realidad.html,,El Pais
2021-02-24T08:37:00,"Inmigración: Últimas noticias, videos y fotos de Inmigración | Univision","Ante la crisis que se vive en Washington DC por la masiva llegada de inmigrantes provenientes de Texas y Arizona, el Concejo votó a favor de una serie de medidas que ayudarían a mitigar el ...",https://www.univision.com/temas/inmigracion,,Univision
2021-02-18T17:03:00,Inmigración: gobierno de Joe Biden prepara nuevas normas para ICE,"En EE.UU., el gobierno de Joe Biden prepara nuevos parámetros de acción para el Servicio de Inmigración y Control de Aduanas, ICE por sus siglas. Las normas parecen dar marcha atrás con las ...",https://cnnespanol.cnn.com/video/estados-unidos-gobierno-politica-biden-ice-inmigracion-normas-trump-frontera-jennifer-montoya-cafe-cnn/,,CNN
2021-01-10T07:05:00,La inmigración suma,"¿La inmigración es buena o mala? ¿Favorece al crecimiento o perjudica a los trabajadores? Aunque la historia del Uruguay es un ejemplo de lo positivo de la inmigración, cada ola inmigratoria ...",https://www.elpais.com.uy/opinion/columnistas/ignacio-munyo/inmigracion-suma.html,,El Pais
2020-03-01T07:04:00,Donald Trump logra frenar la inmigración a Estados Unidos sin la necesidad del muro,La política de inmigración del presidente Donald Trump —desde la orden ejecutiva 13.769 (que limitó tanto los viajes como la inmigración de personas de varios países de Medio Oriente) y ...,https://www.elpais.com.uy/mundo/donald-trump-logra-frenar-inmigracion-estados-unidos-necesidad-muro.html,,El Pais
2019-11-02T00:33:00,"Inmigración, el elemento de ataque contra Joe Biden en el segundo debate",El segundo debate en Detroit presentado por CNN se enfocó en ataques contra el exvicepresidente Joe Biden y su posición sobre el tema de inmigración. Biden fue enfático en afirmar que es ...,https://cnnespanol.cnn.com/video/debate-democrata-cnn-cafe-live-gustavo-valdes/,,CNN
2019-10-23T18:35:00,"Inmigración española, asiática y africana","Castas en el virreinato: Lobo Inmigración africana Otra inmigración, en este caso forzada, fue la de africanos. Éstos llegaron a América comprados como esclavos por autoridades españolas ...",https://es.paperblog.com/inmigracion-espanola-asiatica-y-africana-5574012/,,Paperblog
2019-05-23T00:47:00,Inmigración: un sistema que está al tope de su capacidad en la frontera,El secretario de Seguridad Nacional Interino de Estados Unidos tuvo que defender la solicitud de 4.500 millones de dólares adicionales para lidiar con la situación inmigratoria en la frontera ...,https://cnnespanol.cnn.com/video/sistema-al-tope-de-su-capacidad-frontera-inmigracion-pkg-valdes/,,CNN
2019-05-16T17:47:00,Inmigración: dramáticas imágenes del rescate de un niño en el río Bravo,"El agente de la Patrulla Fronteriza Brady Waikel fue quien salvó a un niño hondureño que intentó cruzar el río a bordo de una piscina inflable. Redacción LAVOZ jueves, 16 de mayo de 2019 14: ...",https://www.lavoz.com.ar/mundo/inmigracion-dramaticas-imagenes-del-rescate-de-un-nino-en-rio-bravo/,,lavoz.com.ar
2019-05-08T00:04:00,"Camañas, la inmigración como estrategia de supervivencia","© HERALDO DE ARAGON EDITORA, S.L.U. Teléfono 976 765 000 / - Pº. Independencia, 29, 50001 Zaragoza - CIF: B99288763 - Inscrita en el Registro Mercantil de Zaragoza ...",https://www.heraldo.es/multimedia/imagenes/aragon/teruel/camanas-la-inmigracion-como-estrategia-de-supervivencia/,,Heraldo de Aragón
2019-02-19T15:14:00,Problemas reales (emigración) e imaginarios (inmigración),"Una de las habilidades más características de los políticos populistas, como los del actual gobierno húngaro (y muchos otros países), es la de crear problemas de asuntos banales o directament ...",https://es.paperblog.com/problemas-reales-emigracion-e-imaginarios-inmigracion-3294367/,,Paperblog
2018-10-14T22:18:00,Inmigración en Uruguay a comienzos del siglo XX,"Entre 1865 y 1868, el número de inmigrantes que llegó a Montevideo atraído por la activación comercial,.., fue muy grande. Si en 1860 los extranjeros, según el censo, eran el 48% de la ...",https://es.paperblog.com/inmigracion-en-uruguay-a-comienzos-del-siglo-xx-2724618/,,Paperblog
2018-10-05T08:19:00,La inmigración irregular se dispara un 116% en Canarias en el inicio del año,"Si se mantuviera este ritmo migratorio del primer mes y medio, 2022 sería el peor ejercicio desde que se elaboran estadísticas sobre la llegada de sin papeles. Se produce pese a la ayuda ...",https://www.elconfidencial.com/autores/ignacio-cembrero-1484/6/,,El confidencial
2018-09-20T23:15:00,Trump presiona en inmigración y exige más resultados al secretario de Justicia,"En EE.UU. el presidente Donald Trump presiona en políticas de inmigración y además propuso a España construir un muro de unos 4.800 kilómetros de ancho —el ancho del norte de África—, en ...",https://cnnespanol.cnn.com/video/trump-espana-muro-mexico-secretario-justicia-ione/,,CNN
2018-09-16T10:11:00,Inmigración será clave en comicios,"Europa se está dividiendo claramente (...) Está claro que hay unas posiciones muy de Europa cerrada y otras que entienden que necesitamos una parte de inmigración, de forma ordenada y regular ...",https://www.elpais.com.uy/mundo/inmigracion-sera-clave-comicios.html,,El Pais
2018-09-10T17:53:00,Cómo fue la primera gran ley para prohibir la inmigración a EE.UU. 130 años antes de la llegada de Donald Trump al poder,China fue el primer país en recibir una restricción masiva de inmigrantes a EE.UU. Un presidente firmó una ley que inicialmente prohibía por 10 años la entrada de trabajadores de esta ...,https://www.24horas.cl/noticiasbbc/como-fue-la-primera-gran-ley-para-prohibir-la-inmigracion-a-eeuu-130-anos-antes-de-la-llegada-de-donald-trump-al-poder-2312906,,24 Horas Chile
2018-07-06T20:36:00,Razones y posibilidades del llamado a abolir la policía de inmigración (ICE) en EEUU,"6 de julio de 2018, 1:29 p. m. Ante la separación de familias indocumentadas detenidas en la frontera y la creciente actividad de redadas de inmigración dentro de Estados Unidos, acciones del gobierno federal que han causado profundo desasosiego a ...",https://es.noticias.yahoo.com/razones-y-posibilidades-del-llamado-abolir-la-policia-de-inmigracion-ice-en-eeuu-202955443.html,,Yahoo Noticias España
2018-07-02T20:37:00,Inmigración y pobreza,"Las noticias sobre México y Trump se destacan a medida que se arrima la toma de posesión presidencial en USA. México es un país riquísimo en recursos naturales y extensión territorial, su ...",https://www.elnuevoherald.com/opinion-es/cartas/article124515689.html,,El Nuevo Herald
2018-05-27T07:26:00,Trump pide ley de inmigración dura para frenar a delincuentes,"Una semana después de que utilizó la palabra animales para describir a los peligrosos delincuentes que entran a Estados Unidos ilegalmente, el presidente Donald Trump viajó al epicentro de ...",https://www.elpais.com.uy/mundo/trump-pide-ley-inmigracion-dura-frenar-delincuentes.html,,El Pais
2018-04-24T17:33:00,Inmigración es el tema en Iowa,"Si bien Iowa no es un estado fronterizo, la inmigración es un tema que preocupa a los electores. La inmigración ilegal es una de las mayores inquietudes de los electores en Iowa. Ésta fue la respuesta de Ray Hoffman, presidente del partido republicano ...",http://news.bbc.co.uk/hi/spanish/specials/2007/elecciones_eeuu_2008/newsid_7168000/7168729.stm,,BBC Mundo
2018-04-06T08:35:00,La inmigración crece casi un 6% en Aragón en el primer trimestre,"Aunque no se deje de hablar de la operación retorno de los inmigrantes a sus países de origen, y en la mente de casi todos ellos esté llegar a cumplir este sueño un día, los datos siguen ...",https://www.heraldo.es/noticias/aragon/la_inmigracion_crece_casi_aragon_primer_trimestre.html,,Heraldo
2018-02-06T16:24:00,"Rajoy matiza sus declaraciones sobre inmigración y Corbacho le dice que ""ha metido la pata""","El presidente del Partido Popular, Mariano Rajoy, ha matizado este martes sus declaraciones sobre inmigración que realizó delante de la cúpula de su partido y que han levantado un importante ...",https://www.heraldo.es/noticias/nacional/rajoy_matiza_sus_declaraciones_sobre_inmigracion_corbacho_dice_que_metido_pata.html,,Heraldo de Aragón
2018-02-05T02:38:00,"Inmigración ilegal hacia Europa, efecto de la revolución","Europa está sufriendo los efectos secundarios de la revolución en el mundo árabe. A raíz de que Túnez descuidara sus fronteras tras la huida del ex presidente Ben Alí, miles de refugiados ...",https://www.heraldo.es/noticias/internacional/la_inmigracion_ilegal_hacia_europa_efecto_secundario_revolucion.html,,Heraldo de Aragón
2017-12-01T19:03:00,Inmigración y Estado de bienestar en España,"Un estudio realizado por Francisco Javier Moreno Fuentes y María Bruquetas Callejo, financiado por la Obra Social la Caixa, explica cómo los inmigrantes aportan más de lo que cuestan al ...",https://es.paperblog.com/inmigracion-y-estado-de-bienestar-en-espana-537024/,,Paperblog
2017-11-07T02:12:00,inmigracion ilegal,Los países centrales están en crisis por su incapacidad para lidiar con los cientos de miles de personas que entran a su territorio escapando del hambre y la guerra. Frente a este enorme ...,https://www.infobae.com/tag/inmigracion-ilegal/,,Infobae
2017-11-02T10:53:00,La inmigración ilegal sube un 3% pese al acuerdo de abril entre Madrid y Rabat,El objetivo de España es atajar la masiva llegada de personas a nuestras costas. Un propósito con el que se comprometió Mohamed VI ante Sánchez y que se reforzó con una reunión de alto nivel ...,https://www.lainformacion.com/tags/inmigracion/,,La Información
2017-08-14T09:08:00,Efectos de la inmigración en el tejido social,En Éxodo Collier deja en claro que el tema no debe tratarse como una cuestión binaria —la inmigración es buena o mala— sino entender cuáles son los efectos de la diversidad en el tejido ...,https://www.elpais.com.uy/economia-y-mercado/efectos-inmigracion-tejido-social.html,,El Pais
2017-08-04T13:04:00,Los límites a la inmigración promovidos por Trump perjudicarían la economía,"El presidente de EEUU, Donald Trump, ha puesto en marcha otra promesa de su campaña electoral al respaldar públicamente un proyecto de ley en el Senado dirigido a reducir la inmigración, de manera que admitiría más emigrantes altamente calificados y ...",https://es-us.finanzas.yahoo.com/noticias/los-limites-la-inmigracion-promovidos-por-trump-perjudicarian-la-economia-124949718.html,,Yahoo Finanzas
2017-06-13T07:05:00,Cómo Elegir el Mejor Abogado de Inmigración: 8 Consejos,"Si alguna vez ha hecho una búsqueda de Google para un abogado de inmigración en su área, usted sabe que hay muchos abogados que manejan las mismas áreas de la ley. Desde su primera aparición ...",https://es.paperblog.com/como-elegir-el-mejor-abogado-de-inmigracion-8-consejos-4402041/,,Paperblog
2017-03-12T07:15:00,Inmigración: segunda batalla,"Una nueva batalla legal enfrentará esta semana el presidente Donald Trump, como consecuencia de su política de inmigración, debido a que seis estados se aprestan a presentar acciones judiciales ...",https://www.elpais.com.uy/mundo/inmigracion-segunda-batalla.html,,El Pais
2017-02-16T23:40:00,Tensión sobre inmigración en EE.UU.,"Rep. Norma Torres, D-California, denuncia haber sido expulsada de reunión con el dir. de ICE por el Pres. de la Comisión Judicial de la Cámara. Noticias culturales",https://cnnespanol.cnn.com/video/exp-cnne-rep-norma-torres-meeting-with-ice/,,CNN
